,VIDEOID,PUBLISHEDAT,TITLE,TAGS,VIEWCOUNT,LIKECOUNT,COMMENTCOUNT,CONTENTDETAILS,CATEGORYID,VIDEO_TIME,PUBLISHED_PERIOD,YEAR_MONTH,DAY_OF_WEEK_NAME,DAY_OF_WEEK_NUMBER,CATEGORY_TITLE
0,iDLQHJ2Tta8,2024-06-24 11:19:37,DLACZEGO I KIEDY NIEMCY PRZEGRAŁY II WOJNĘ ŚWIATOWĄ? | MILITARNE ZERO #20,"['Stanowski', 'Krzysztof Stanowski', 'kanał zero', 'kanal zero', 'stanowski kanał', 'Krzysztof stanowski kanał zero', 'stanowski kanał zero', 'kanał', 'zero', 'stanowski', 'jarosław wolski', 'norbet bączyk', 'niemcy 2 wojna światowa', 'dlaczego niemcy przegrali 2 wojnę światową', 'ukraina', 'wojna na ukrainie', 'wolski kanał zero', 'mlitaria', 'militarne zero', 'przyczyny porażki niemiec', '2 wojna światowa', 'bomba atomowa', 'alianci 2 wojna', 'alianci', 'wojna światowa niemcy', '2 wojna światowa niemcy', 'przyczyny 2 wojny światowej']",198042,10922,1163,PT30M59S,25,30.98,Morning,2024-06,Monday,0,News & Politics
1,3UaVgRYkx9M,2024-07-07 13:00:03,"WYBORY WE FRANCJI, NOWY RZĄD WIELKIEJ BRYTANII, ORBAN W KIJOWIE I W MOSKWIE - ŚWIAT OD ZERA #13","['kanał zero extra', 'kanal zero extra', 'kanal zero', 'Stanowski', 'Krzysztof Stanowski', 'kanał zero', 'stanowski kanał', 'Krzysztof stanowski kanał zero', 'stanowski kanał zero', 'kanał', 'zero', 'stanowski', 'kanał zero świat od zera', 'kanał zero arleta bojke', 'orban', 'viktor orban', 'rosja', 'moskwa', 'kijów', 'francja', 'wybory francja', 'marine le pen', 'pożary w grecji', 'kanał zero marine le pen', 'świat od zera arleta bojke', 'arleta bojke francja', 'wielka brytania', 'anglia wybory', 'keir starmer', 'keir starmer kanał zero']",127937,5467,628,PT40M23S,25,40.38,Afternoon,2024-07,Sunday,6,News & Politics
2,ug23y3FlwCE,2024-07-27 13:01:19,"DZIENNIKARSKIE ZERO: PKP CARGO, CZYLI JAK ZARŻNIĘTO WIELKĄ FIRMĘ","['Stanowski', 'Krzysztof Stanowski', 'kanał zero', 'kanal zero', 'stanowski kanał', 'Krzysztof stanowski kanał zero', 'stanowski kanał zero', 'kanał', 'zero', 'stanowski', 'pkp cargo', 'upadek pkp cargo', 'co to pkp cargo', 'czym się zajmuje pkp cargo', 'stanowski pkp cargo', 'pociągi', 'przewóz towarów', 'przewoźnik węgla', 'polityka', 'związki zawodowe', 'związki zawodowe pkp cargo', 'pkp cargo problemy', 'pkp cargo zwolnienia', 'pkp cargo zwalnia pracowników', 'kolej państwowa', 'prezes pkp cargo', 'pkp', 'polskie koleje państwowe']",726955,27109,3715,PT37M36S,25,37.6,Afternoon,2024-07,Saturday,5,News & Politics
3,J1AHNSpHX0A,2024-07-08 21:10:45,GROUND ZERO #24: DOKĄD ZMIERZA FRANCJA? GOŚĆ: KACPER KITA,"['Stanowski', 'Krzysztof Stanowski', 'kanał zero', 'kanal zero', 'stanowski kanał', 'Krzysztof stanowski kanał zero', 'stanowski kanał zero', 'kanał', 'zero', 'kanal', 'rajmund andrzejczak', 'gen. rajmund andrzejczak', 'geopolityka', 'Sławomir dębski', 'dębski', 'ground zero', 'andrzejczak', 'andrzejczak kanał zero', 'ground zero kanal zero', 'polityka zagraniczna', 'zaleski kanał zero', 'francja', 'francja marine le pan', 'wybory francja', 'unia europejska', 'wybory we francji', 'francja 2024', 'kanał zero marine le pan', 'kacper kita']",91890,3001,164,PT2H20M35S,25,140.58,Evening,2024-07,Monday,0,News & Politics
4,R_fBxRBVafc,2024-07-23 20:42:29,"DEBATA: WOŁYŃ. STANOWSKI, ZYCHOWICZ, PARAFIANOWICZ, MOTYKA, SKÓRKA","['Stanowski', 'Krzysztof Stanowski', 'kanał zero', 'kanal zero', 'stanowski kanał', 'Krzysztof stanowski kanał zero', 'stanowski kanał zero', 'kanał', 'zero', 'godzina zero', 'kanal', 'krzysztof stanowski', 'stanowski', 'polityka', 'debata', 'debata kanal zero', 'stanowski debata', 'debata wołyń', 'debata o wołyniu', 'wołyń', 'wołyń kanał zero', 'wołyń debata', 'ukraina', 'ukraina wołyń', 'wołyń ukraina', 'Piotr Zychowicz', 'Grzegorz Motyka', 'Mirosław Skórka', 'rzeź wołyńska', 'Wołyń', 'Ukraina', 'historia', 'parafianowicz', 'zbigniew parafianowicz']",522457,17634,3709,PT2H35M1S,25,155.02,Evening,2024-07,Tuesday,1,News & Politics
5,8QTeQiyXb2E,2024-07-14 12:11:44,ZAMACH NA DONALDA TRUMPA. CO WIEMY PO ATAKU NA WIECU W PENSYLWANII,"['kanal zero', 'Stanowski', 'Krzysztof Stanowski', 'kanał zero', 'stanowski kanał', 'Krzysztof stanowski kanał zero', 'stanowski kanał zero', 'kanał', 'zero', 'stanowski', 'donald trump', 'trump', 'trump zamach', 'donald trump zamach', 'wiec trumpa', 'wybory', 'wybory usa', 'wybory stany zjednoczone', 'wybory trump', 'wybory trump biden', 'kampania wyborcza', 'kampania wyborcza stany zjednoczone', 'kampania wyborcza trump', 'trump biden', 'teorie spiskowe', 'teoria spiskowa trump', 'donald trump postrzelony', 'strzał trump']",478248,18010,2451,PT13M16S,25,13.27,Afternoon,2024-07,Sunday,6,News & Politics
6,ix53g2XVlvk,2024-07-12 18:55:59,"PRZEGRANE GŁOSOWANIE KO, ODEBRANE IMMUNITETY PIS","['kanał zero extra', 'kanal zero extra', 'kanal zero', 'Stanowski', 'Krzysztof Stanowski', 'kanał zero', 'stanowski kanał', 'Krzysztof stanowski kanał zero', 'stanowski kanał zero', 'kanał', 'zero', 'stanowski', 'donald tusk', 'premier tusk', 'kanał zero dusk', 'kanał zero donald tusk', 'sejm', 'głosowanie w sejmie', 'the best of sejm', 'marzałek', 'szymon hołowania', 'prawo i sprawiedliwość', 'ambasador nato', 'koalicja obywatelska', 'sejm polski', 'polityka', 'politycy', 'konfederacja', 'lewica', 'polityka polska', 'ustawy', 'błaszczak']",197080,5774,1135,PT10M20S,25,10.33,Evening,2024-07,Friday,4,News & Politics
7,w9--YnQZ4bs,2024-07-01 07:45:37,"JORDAN BARDELLA – KIM JEST MŁODY POLITYK, KTÓRY STOI ZA SUKCESEM ZJEDNOCZENIA NARODOWEGO WE FRANCJI?","['Stanowski', 'Krzysztof Stanowski', 'kanał zero', 'kanal zero', 'stanowski kanał', 'Krzysztof stanowski kanał zero', 'stanowski kanał zero', 'zero', 'stanowski', 'arleta bojke', 'kanał zero arleta bojke', 'francja', 'wybory francja', 'wybory francja 2024', 'jordan bardella', 'kanał zero francja', 'commentary', 'premier francji', 'kanał zero marine le pan', 'marinelepen', 'marine le pen', 'kanał zero wybory', 'kanał zero wybory francja', 'macron', 'prezydent macron', 'polityka', 'polityka francja', 'francja wybory', 'wybory we francji']",150227,5797,691,PT12M3S,25,12.05,Morning,2024-07,Monday,0,News & Politics
8,cNdQa-_j2lI,2024-07-27 07:00:31,ŚLEDZTWO PO ZAMACHU NA TRUMPA. SECRET SERVICE NA CENZUROWANYM,"['Stanowski', 'Krzysztof Stanowski', 'kanał zero', 'kanal zero', 'stanowski kanał', 'Krzysztof stanowski kanał zero', 'stanowski kanał zero', 'kanał', 'zero', 'stanowski', 'joanna pinkwart', 'commentary', 'donald trump', 'trump', 'jak doszło do zamachu na trumpa', 'secret service', 'secret service kanał zero', 'czy secret service zawiodło', 'czym jest secret service', 'secret service donald trump', 'kanał zero joanna pinkwart', 'zamach na trumpa', 'donald trump postrzelony', 'donald trump ranny', 'secret service ochrona', 'ameryka']",130834,5696,410,PT12M33S,25,12.55,Morning,2024-07,Saturday,5,News & Politics
9,g35xIwKAFCc,2024-08-01 17:30:04,NAJWIĘKSZA WYMIANA WIĘŹNIÓW OD CZASU ZIMNEJ WOJNY. DLACZEGO DO NIEJ DOSZŁO I KTO ODZYSKAŁ WOLNOŚĆ,"['Stanowski', 'Krzysztof Stanowski', 'kanał zero', 'kanal zero', 'stanowski kanał', 'Krzysztof stanowski kanał zero', 'stanowski kanał zero', 'kanał', 'zero', 'stanowski', 'maria stepan', 'commentary', 'wymiana więźniów', 'turcja wymiana więźniów', 'o co chodzi w wymianie więźniów', 'rosja', 'usa', 'stany zjednoczone', 'zachód', 'wschód', 'wymiana więźniów między zachodem i wschodem', 'szpiedzy', 'wymiana szpiegów', 'szpiedzy rosja', 'szpiedzy usa', 'stany zjednoczone rosja', 'białoruś', 'kanał zero wymiana więźniów', 'kanał zero szpieg', 'turcja']",75591,3584,214,PT11M25S,25,11.42,Afternoon,2024-08,Thursday,3,News & Politics
10,rh66vX_gbg4,2024-06-13 13:56:28,TUSK DOKRĘCI TERAZ ŚRUBĘ KOALICJANTOM - ROBERT MAZUREK KOMENTUJE,"['Stanowski', 'Krzysztof Stanowski', 'kanał zero', 'kanal zero', 'stanowski kanał', 'Krzysztof stanowski kanał zero', 'stanowski kanał zero', 'kanał', 'zero', 'stanowski', 'mazurek', 'robert mazurek', 'mazurek o tusku', 'polityka', 'donald tusk', 'premier tusk', 'koalicja obywatelska', 'commentary', 'robert mazurek kanał zero', 'mazurek zero', 'robert mazurek tusk', 'robert mazurek o tusku', 'tusk mazurek', 'mazurek tusk', 'robert mazurek commentary', 'mazurek komentuje', 'koalicja', 'koalicja tuska', 'premier donald tusk']",363498,16720,1479,PT16M38S,25,16.63,Afternoon,2024-06,Thursday,3,News & Politics
11,7WGO-vaE7gg,2024-07-31 16:32:42,"LIDERZY HAMASU I HEZBOLLAHU ZGINĘLI W ATAKACH IZRAELA, IRAN ZAPOWIADA ODWET","['Stanowski', 'Krzysztof Stanowski', 'kanał zero', 'kanal zero', 'stanowski kanał', 'Krzysztof stanowski kanał zero', 'stanowski kanał zero', 'kanał', 'zero', 'stanowski', 'arleta bojke', 'bojke', 'bojke kanał zero', 'izrael', 'izrael wojna', 'izrael liban', 'liban', 'hezbollah', 'palestyna', 'strefa gazy', 'izrael hamas', 'hamas', 'Fuad Szukr', 'izarel liban', 'liban izrael', 'izrael liban wojna', 'wojna w izraelu', 'izarel wojna 2024', 'liban wojna', 'liban izarel', 'izrael wojna domowa', 'wojna w izarelu', 'izarel hamas', 'hamas izarel']",87094,3903,555,PT11M12S,25,11.2,Afternoon,2024-07,Wednesday,2,News & Politics
12,XXRAJKig0wY,2024-06-22 10:11:24,DUKAJ I RYMKIEWICZ USUNIĘCI Z LISTY LEKTUR I MNIEJ RELIGII W SZKOŁACH - ROBERT MAZUREK KOMENTUJE,"['Stanowski', 'Krzysztof Stanowski', 'kanał zero', 'kanal zero', 'stanowski kanał', 'Krzysztof stanowski kanał zero', 'stanowski kanał zero', 'kanał', 'zero', 'stanowski', 'robert mazurek', 'mazurek kanał zero', 'mazurek komentuje', 'barbara nowacka', 'nowacka', 'edukacja', 'szkolnictwo', 'reforma edukacja', 'szkoła', 'lektury', 'lektury szkolne', 'mazurek nowacka', 'polityka', 'religia w szkole', 'ministerstwo edukacji', 'nowacka barbara', 'nowacka prace domowe', 'prace domowe w szkole', 'prace domowe', 'uczniowe', 'prace domowe nowacka', 'dukaj']",289091,17157,2269,PT17M1S,25,17.02,Morning,2024-06,Saturday,5,News & Politics
13,OQritSjw54o,2024-07-22 14:38:18,JOE BIDEN ZREZYGNOWAŁ. KIM JEST KAMALA HARRIS? NA JAKICH WYBORCÓW LICZĄ DEMOKRACI?,"['Stanowski', 'Krzysztof Stanowski', 'kanał zero', 'stanowski kanał', 'Krzysztof stanowski kanał zero', 'stanowski kanał zero', 'kanał', 'zero', 'stanowski', 'dębski', 'sławomir dębski', 'dębski kanał zero', 'joe biden', 'kanał zero joe biden', 'kamala harris', 'demokraci', 'demokraci stany zjednoczone', 'kto za joe bidena', 'kandydat demokratów', 'kto jak nie joe biden', 'kandydaci na prezydenta usa', 'kandydad na prezydenta stany', 'stany zjednoczone', 'stany zjednoczone wybory', 'wybory w stanach 2024', 'joe biden reyzgnuje']",89235,3614,332,PT17M54S,25,17.9,Afternoon,2024-07,Monday,0,News & Politics
14,8pD9Ep1yMos,2024-07-16 19:18:37,AMERYKAŃSKI SEN KONTROWERSYJNEGO ŻÓŁTODZIOBA - JD VANCE KANDYDATEM DONALDA TRUMPA NA WICEPREZYDENTA,"['Stanowski', 'Krzysztof Stanowski', 'kanał zero', 'kanal zero', 'stanowski kanał', 'Krzysztof stanowski kanał zero', 'stanowski kanał zero', 'kanał', 'zero', 'stanowski', 'joanna pinkwart', 'kanał zero wybory stany zjednoczone', 'wybory usa', 'pinkwart usa', 'donald trump', 'jd vance', 'trump prezydent', 'prezydent usa', 'prezydent stany zjednoczone', 'wybory stany', 'wybory stany zjednoczone', 'wiceprezydent usa', 'wiceprezydent stany zjednoczone', 'republikanie', 'kanał zero donald trump', 'pinkwart trump', 'usa wybory 2024']",160545,5635,419,PT13M10S,25,13.17,Evening,2024-07,Tuesday,1,News & Politics
15,8pD9Ep1yMos,2024-07-16 19:18:37,AMERYKAŃSKI SEN KONTROWERSYJNEGO ŻÓŁTODZIOBA - JD VANCE KANDYDATEM DONALDA TRUMPA NA WICEPREZYDENTA,"['Stanowski', 'Krzysztof Stanowski', 'kanał zero', 'kanal zero', 'stanowski kanał', 'Krzysztof stanowski kanał zero', 'stanowski kanał zero', 'kanał', 'zero', 'stanowski', 'joanna pinkwart', 'kanał zero wybory stany zjednoczone', 'wybory usa', 'pinkwart usa', 'donald trump', 'jd vance', 'trump prezydent', 'prezydent usa', 'prezydent stany zjednoczone', 'wybory stany', 'wybory stany zjednoczone', 'wiceprezydent usa', 'wiceprezydent stany zjednoczone', 'republikanie', 'kanał zero donald trump', 'pinkwart trump', 'usa wybory 2024']",160545,5635,419,PT13M10S,25,13.17,Evening,2024-07,Tuesday,1,News & Politics
16,6lyqd7C-eig,2024-06-26 17:34:53,CPK WEDŁUG TUSKA. POLSKA BĘDZIE MEGALOPOLIS,"['kanał zero extra', 'kanal zero extra', 'kanal zero', 'Stanowski', 'Krzysztof Stanowski', 'kanał zero', 'stanowski kanał', 'Krzysztof stanowski kanał zero', 'stanowski kanał zero', 'kanał', 'zero', 'stanowski', 'arleta bojke', 'commentary', 'donald tusk', 'tusk', 'tusk cpk', 'cpk', 'centralny port komunikacyjny', 'inwestycja', 'polityka', 'polska', 'cpk polska', 'platforma obywatelska', 'donald tusk cpk', 'cpk donald tusk', 'cpk tuska', 'cpk tusk', 'warszawa', 'gdańsk', 'wrocław', 'Łódź', 'Szczecin', 'linie kolejowe', 'linie kolejowe cpk', 'lotnisko cpk']",180077,7812,2009,PT16M59S,25,16.98,Afternoon,2024-06,Wednesday,2,News & Politics
17,ccqBMTa7vCo,2024-03-26 11:01:49,"DZIENNIKARSKIE ZERO #3: KOLEJNY ATAK WYBORCZEJ, KOLEJNA ORKA","['Stanowski', 'Krzysztof Stanowski', 'kanał zero', 'kanal zero', 'stanowski kanał', 'Krzysztof stanowski kanał zero', 'stanowski kanał zero', 'kanał', 'zero', 'stanowski', 'stanowski wyborcza', 'stanowski gazeta wyborcza', 'dziennikarskie zero', 'dziennikarskie zero wyborcza', 'krzysztof stanowski gazeta wyborcza', 'zero kanal', 'krzysztof stanowski wybrocza', 'gazeta wyborcza stanowski', 'wyborcza stanowski', 'stanowski odpowiada wyborczej']",1161411,92551,9818,PT42M54S,22,42.9,Morning,2024-03,Tuesday,1,People & Blogs
18,sk6qQcc8uxY,2024-06-28 17:00:41,"""KROK W DOBRĄ STRONĘ, ALE NADAL NIE WSZYSTKO TRZYMA SIĘ KUPY"" | CENTRALNY PROGRAM KOMUNIKACYJNY #4","['Stanowski', 'Krzysztof Stanowski', 'kanał zero', 'kanal zero', 'stanowski kanał', 'Krzysztof stanowski kanał zero', 'stanowski kanał zero', 'zero', 'stanowski', 'kanal', 'polityka', 'cpk', 'Centralny Port Komunikacyjny', 'Dlaczego powinniśmy zbudować CPK', 'HUB', 'lotniska europejskie', 'tusk', 'koalicja obywatelska', 'maciej wilk kanal zero', 'maciej wilk', 'maciej wilk cpk', 'wilk cpk', 'cpk w polsce', 'wilk o cpk', 'maciej wilk o cpk', 'cpk kanal zero', 'budowa cpk', 'centralny port komunikacyjny w polsce', 'lotnisko chopina', 'baranów']",171658,13477,1525,PT21M10S,22,21.17,Afternoon,2024-06,Friday,4,People & Blogs
19,s7YYk6aLmaI,2024-07-21 08:00:07,"TRZECIE ŚNIADANIE #25 - MELLER, WRÓBLEWSKI, DANIELEWSKI, LISICKI, WIŚNIEWSKA","['Stanowski', 'Krzysztof Stanowski', 'kanał zero', 'kanal zero', 'stanowski kanał', 'Krzysztof stanowski kanał zero', 'stanowski kanał zero', 'kanał', 'zero', 'stanowski', 'marcin meller', 'agnieszka wiśniewska', 'tomasz wróblewski', 'paweł lisicki', 'michał danielewski', 'polityka', 'oko press', 'krytyka polityczna', 'Warsaw Enerprise Institute', 'do rzeczy', 'trzecie śniadanie', 'marcin meller kanał zero', 'kanał zero polityka', 'kanał zero wiśniewska', 'kanał zero wróblewski', 'pałac rozalin', 'kanał zero trzecie śniadanie']",72034,2263,898,PT1H48M27S,22,108.45,Morning,2024-07,Sunday,6,People & Blogs
20,-Ad8dp7asEo,2024-07-11 10:39:33,WYPADEK NA A1. CO DALEJ Z PODEJRZANYM SEBASTIANEM M.?BEZRADNOŚĆ PRAWNA PAŃSTWA,"['Stanowski', 'Krzysztof Stanowski', 'kanał zero', 'kanal zero', 'stanowski kanał', 'Krzysztof stanowski kanał zero', 'stanowski kanał zero', 'kanał', 'zero', 'stanowski', 'wypadek a1', 'sebastian m', 'sebastian m wypadek a1', 'a1 katastrofa', 'zjednoczone emiraty arabskie', 'ucieczka z miejsca wypadku', 'sebastian m uciekł z miejsca wypadku', 'śmierć rodziny', 'dziecko nie żyje', 'spalone auto', 'wrzesień 2023 wypadek', 'rodzina spłonęła żywcem', 'spalone auto autostrada a1', 'prokuratura', 'ekstradycja', 'ekstradycja sebastin m']",371365,16817,4373,PT23M52S,22,23.87,Morning,2024-07,Thursday,3,People & Blogs
21,cryApxI6DRM,2024-06-28 15:56:08,STANOWSKI O MUZEUM W GDAŃSKU. NIE DO WIARY,"['Stanowski', 'Krzysztof Stanowski', 'kanał zero', 'kanal zero', 'stanowski kanał', 'Krzysztof stanowski kanał zero', 'stanowski kanał zero', 'kanał', 'zero', 'stanowski', 'muzem gdańsk', 'muzeum ii wojny światowej w gdańsku', 'muzeum ii wojny światowej', 'commentary', 'gdańsk', 'gdańsk muzeum', 'rotmistrz pilecki', 'rodzina ulmów', 'maksymilian kolbe', 'polityka', 'politycy', 'prawo i sprawiedliwość', 'paweł mach', 'Paweł Machcewicz', 'gazeta wyborcza', 'gazeta wyborcza stanowski', 'stanowski o muzeum w gdańsku', 'muzeum w gdańsku']",605943,53272,7111,PT20M1S,22,20.02,Afternoon,2024-06,Friday,4,People & Blogs
22,O1TCCHrDF7I,2024-04-20 18:00:16,"ZERO PRESJI #6: Twister ze STANOWSKIM, MAZURKIEM, RUCIŃSKIM I SIKORĄ","['Stanowski', 'Krzysztof Stanowski', 'kanał zero', 'kanal zero', 'stanowski kanał', 'Krzysztof stanowski kanał zero', 'stanowski kanał zero', 'kanał', 'zero', 'stanowski', 'zero presji', 'kacper ruciński', 'ruciński', 'sikora', 'czarek sikora', 'stand up', 'mazurek', 'robert mazurek', 'mazurek kanal zero', 'mazurek zero presji', 'stanowski zero presji', 'sikora zero presji', 'ruciński zero presji', 'rucinki stanowski', 'sikora mazurek', 'komedia', 'sikora stand up', 'czarek sikora stand up', 'rucinski stand up', 'stanowski mazurek']",424048,13187,1129,PT1H35M10S,22,95.17,Evening,2024-04,Saturday,5,People & Blogs
23,s7YYk6aLmaI,2024-07-21 08:00:07,"TRZECIE ŚNIADANIE #25 - MELLER, WRÓBLEWSKI, DANIELEWSKI, LISICKI, WIŚNIEWSKA","['Stanowski', 'Krzysztof Stanowski', 'kanał zero', 'kanal zero', 'stanowski kanał', 'Krzysztof stanowski kanał zero', 'stanowski kanał zero', 'kanał', 'zero', 'stanowski', 'marcin meller', 'agnieszka wiśniewska', 'tomasz wróblewski', 'paweł lisicki', 'michał danielewski', 'polityka', 'oko press', 'krytyka polityczna', 'Warsaw Enerprise Institute', 'do rzeczy', 'trzecie śniadanie', 'marcin meller kanał zero', 'kanał zero polityka', 'kanał zero wiśniewska', 'kanał zero wróblewski', 'pałac rozalin', 'kanał zero trzecie śniadanie']",72034,2263,898,PT1H48M27S,22,108.45,Morning,2024-07,Sunday,6,People & Blogs
24,8WYZ1NjeKdA,2024-03-11 14:00:05,MILITARNE ZERO #5: CZOŁGI - NIEZNISZCZALNE (PRAWIE) MASZYNY,"['Stanowski', 'Krzysztof Stanowski', 'kanał zero', 'kanal zero', 'stanowski kanał', 'Krzysztof stanowski kanał zero', 'stanowski kanał zero', 'kanał', 'zero', 'stanowski', 'wolski', 'wolski kanal zero', 'militarne zero', 'jarosław wolski', 'czołgi', 'czołg', '10 najpotężniejszych czołgów na świecie', 'najpotężniejsze czołgi na świecie', 'najlepsze czołgi na świecie', 'najdroższe czołgi na świecie', 'NATO czołgi', 'Abramsy dla Polski', 'czołg Abrams', 'czołg Armata', 'czołg Leopard', 'wojsko', 'militaria', 'rosjania', 'ukraina', 'pocisk', 'pancerz']",215920,12270,622,PT34M2S,22,34.03,Afternoon,2024-03,Monday,0,People & Blogs
25,tnuhJ8VJGHA,2024-07-22 18:00:07,GROUND ZERO #26: AMERYKAŃSKI IZOLACJONIZM. GOŚĆ PROF. CHARLES A. KUPCHAN,"['Stanowski', 'Krzysztof Stanowski', 'kanał zero', 'kanal zero', 'stanowski kanał', 'Krzysztof stanowski kanał zero', 'stanowski kanał zero', 'kanał', 'zero', 'stanowski', 'kanal', 'rajmund andrzejczak', 'gen. rajmund andrzejczak', 'geopolityka', 'wojsko', 'Sławomir dębski', 'dębski', 'ground zero', 'andrzejczak', 'andrzejczak kanał zero', 'ground zero kanal zero', 'polityka zagraniczna', 'ameryka', 'stany zjednoczone', 'demokracja', 'Charles A. Kupchan', 'charles kupchan kanał zero', 'kanał zero stany zjednoczone', 'amerykański izolacjonizm']",102253,3489,245,PT2H10M9S,22,130.15,Evening,2024-07,Monday,0,People & Blogs
26,DLIrJ3jSHY0,2024-07-20 07:12:01,COMARCH ZNIKA Z GIEŁDY PO 25 LATACH. CO DALEJ ZE SPÓŁKĄ I CRACOVIĄ | BIZNESOWE ZERO #15,"['Stanowski', 'Krzysztof Stanowski', 'kanał zero', 'kanal zero', 'stanowski kanał', 'Krzysztof stanowski kanał zero', 'stanowski kanał zero', 'kanał', 'zero', 'stanowski', 'biznesowe zero', 'andrzej borcz', 'borcz kanał zero', 'comarch', 'comarch erp optima', 'spółka comarch', 'cracovia', 'kraków', 'sukces', 'firma', 'biznes', 'rodzina filipiak', 'filipiak', 'zejście z giełdy', 'akcje', 'obligacje', 'cvc capital partners', 'cvc', 'optima', 'comarch optima']",70237,3180,187,PT31M5S,22,31.08,Morning,2024-07,Saturday,5,People & Blogs
27,zhwNRMmPLNI,2024-07-20 18:00:33,"ZERO PRESJI #19: RUCIŃSKI, SIKORA, KAŁAMAGA, KAMIŃSKA","['kanal zero', 'Stanowski', 'Krzysztof Stanowski', 'kanał zero', 'stanowski kanał', 'Krzysztof stanowski kanał zero', 'stanowski kanał zero', 'kanał', 'zero', 'stanowski', 'kacper ruciński', 'czarek sikora', 'standup', 'stand-up', 'stand up ruciński', 'stand up sikora', 'kanał zero ruciński', 'kanał zero sikora', 'dobra zabawa', 'humor', 'kanał zero śmieszne', 'kanał zero humor', 'kanał zero presji', 'kanał zero zero presji', 'zero presji', 'julia kamińska', 'kanał zero julia kamińska', 'mariusz kałąmaga', 'kanał zero mariusz kałąmaga']",129460,3338,468,PT1H25M12S,22,85.2,Evening,2024-07,Saturday,5,People & Blogs
28,QK8x630c7nw,2024-02-20 14:02:07,BONUS Z MIAMI: NIEPUBLIKOWANY WYWIAD Z CAROLINE DERPIENSKI,"['Stanowski', 'Krzysztof Stanowski', 'kanał zero', 'kanal zero', 'stanowski kanał', 'Krzysztof stanowski kanał zero', 'stanowski kanał zero', 'kanał', 'zero', 'stanowski', 'celebryci', 'krzysztof stanowski', 'caroline derpieński', 'stanowski derpieński', 'dolarsowo', 'dolarsowa', 'Caroline Derpienski', 'Derpienski', 'królowa dolarsów', 'dajmondsy', 'derpienski', 'derpienski kanal zero', 'derpienski stanowski', 'miami', 'caroline derpienski wywiad', 'dzien z caroline', 'wywiad caroline derpienski', 'caroline kanal zero', 'caroline derpienski']",1154673,24229,5210,PT47M30S,22,47.5,Afternoon,2024-02,Tuesday,1,People & Blogs
29,NgU9Qu9jwjU,2024-05-22 15:01:00,COMMENTARY: STANOWSKI O TOMASZU LISIE,"['Stanowski', 'Krzysztof Stanowski', 'kanał zero', 'kanal zero', 'stanowski kanał', 'Krzysztof stanowski kanał zero', 'stanowski kanał zero', 'kanał', 'zero', 'stanowski', 'lis', 'tomasz lis', 'krzysztof stanowski', 'stan', 'dziennikarskie', 'tomasz', 'prokuratura', 'śledztwo', 'twitter', 'publicysta', 'oskarżenie', 'umorzenie', 'śledztwa', 'dziennikarz', 'tomasza lisa', 'łamanie praw', 'pracowniczych', 'prawa', 'czyn', 'redaktor naczelny', 'newsweek', 'nietykalność', 'kompromitacja', 'warszawa', 'triumf', 'sprawa', 'sąd', 'prawa pracownika', 'commentary', 'COMMENTARY', 'proces', 'wwa']",679207,31652,2824,PT16M52S,22,16.87,Afternoon,2024-05,Wednesday,2,People & Blogs
30,v4hSWh5iLas,2024-06-28 14:07:18,DEBATA JOE BIDEN VS DONALD TRUMP. CZY DEMOKRACI MUSZĄ SZUKAĆ NOWEGO KANDYDATA?,"['Stanowski', 'Krzysztof Stanowski', 'kanał zero', 'kanal zero', 'stanowski kanał', 'Krzysztof stanowski kanał zero', 'stanowski kanał zero', 'kanał', 'zero', 'stanowski', 'joanna pinkwart', 'usa', 'stany zjednoczone', 'trump', 'biden', 'trump biden', 'donald trump joe biden', 'debata', 'debata stany zjednoczone', 'ukraina', 'polska', 'prawybory stany zjednoczone', 'donald trump polska', 'kanał zero stany zjednoczone', 'kanał zero trump', 'kanał zero biden', 'kanał zero trump biden', 'kanał zero debata stany zjednoczone']",353881,12701,1566,PT16M5S,22,16.08,Afternoon,2024-06,Friday,4,People & Blogs
31,e3oEMbaZePc,2024-06-12 08:00:32,STANOWSKI: OSIEM WNIOSKÓW PO WYBORACH,"['Stanowski', 'Krzysztof Stanowski', 'kanał zero', 'kanal zero', 'stanowski kanał', 'Krzysztof stanowski kanał zero', 'stanowski kanał zero', 'kanał', 'zero', 'stanowski', 'stanowisko', 'stanowisko kanał zero', 'kanał zero stanowisko', 'kanał zero wybory', 'kanał zero eurowybory', 'unia europejska', 'wybory unia europejska', 'stanowski polityka', 'polityka', 'wybory do europarlamentu', 'stanowski komentuje', 'krzysztof stanowski wybory', 'pis', 'po', 'ko', 'konfederacja', 'lewica', 'psl', 'wybory 2024', '2024']",519681,24987,2733,PT12M36S,22,12.6,Morning,2024-06,Wednesday,2,People & Blogs
32,dinypBfwsWM,2024-07-25 18:33:17,POŻAR FABRYKI PALUSZKÓW BESKIDZKICH I POZYTYWNA REAKCJA SPOŁECZNOŚCI,"['Stanowski', 'Krzysztof Stanowski', 'kanał zero', 'kanal zero', 'stanowski kanał', 'Krzysztof stanowski kanał zero', 'stanowski kanał zero', 'kanał', 'zero', 'stanowski', 'paluszki beskidzkie', 'dawid chęć', 'fabryka paluszków', 'fabryka paluszków beskidzkich', 'hala produkcyjna paluszki', 'dlaczego paluszki są dobre', 'dlaczego hala spłonęła', 'hala z paluszkami', 'kanał zero paluszki', 'kanał zero paluszki beskidzkie', 'kanał zero paluszki hala', 'commentary', 'kanał zero commentary', 'hala płonie', 'paluszki beskidzkie zero']",105993,7500,761,PT9M15S,22,9.25,Evening,2024-07,Thursday,3,People & Blogs
33,NoYV-B3CLS4,2024-07-23 09:22:09,"CPK: PRZEZ 11 LAT POWSTANIE TYLKO JEDNA LINIA KOLEJOWA. ""MASAKRA"" | CENTRALNY PROGRAM KOMUNIKACYJNY","['Stanowski', 'Krzysztof Stanowski', 'kanał zero', 'kanal zero', 'stanowski kanał', 'Krzysztof stanowski kanał zero', 'stanowski kanał zero', 'kanał', 'zero', 'stanowski', 'cpk', 'zmiany w cpk', 'donald tusk cpk', 'centralny port komunikacyjny', 'jakie zmiany wprwadził tusk w cpk', 'zmiany w cpk tuska', 'co się zmieniło w cpk', 'kolej cpk', 'nowy centralny port komunikacyjny', 'polska kolej', 'polskie lotnictwo', 'pociągi cpk', 'maciej wilk', 'maciej wilk cpk', 'maciej wilk o nowym cpk', 'dlaczego projekt cpk nie ma sensu', 'pkp']",134292,13402,1664,PT13M47S,22,13.78,Morning,2024-07,Tuesday,1,People & Blogs
